"No.","Time","Source","Destination","Protocol","Length","Info"
"1","0.000000","192.168.1.7","192.168.1.5","TCP","176","60876  >  8009 [PSH, ACK] Seq=1 Ack=1 Win=501 Len=110 TSval=3801150390 TSecr=568149 [TCP segment of a reassembled PDU]"
"2","0.004834","192.168.1.5","192.168.1.7","TCP","176","8009  >  60876 [PSH, ACK] Seq=1 Ack=111 Win=1425 Len=110 TSval=568650 TSecr=3801150390 [TCP segment of a reassembled PDU]"
"3","0.004862","192.168.1.7","192.168.1.5","TCP","66","60876  >  8009 [ACK] Seq=111 Ack=111 Win=501 Len=0 TSval=3801150395 TSecr=568650"
"4","4.702668","192.168.1.2","224.0.0.251","MDNS","136","Standard query 0x0001 PTR _%9E5E7C8F47989526C9BCD95D24084F6F0B27C5ED._sub._googlecast._tcp.local, ""QU"" question PTR _googlecast._tcp.local, ""QU"" question"
"5","4.702703","192.168.1.2","224.0.0.251","MDNS","136","Standard query 0x0001 PTR _%9E5E7C8F47989526C9BCD95D24084F6F0B27C5ED._sub._googlecast._tcp.local, ""QU"" question PTR _googlecast._tcp.local, ""QU"" question"
"6","5.005480","192.168.1.7","192.168.1.5","TCP","176","60876  >  8009 [PSH, ACK] Seq=111 Ack=111 Win=501 Len=110 TSval=3801155396 TSecr=568650 [TCP segment of a reassembled PDU]"
"7","5.013927","192.168.1.5","192.168.1.7","TCP","176","8009  >  60876 [PSH, ACK] Seq=111 Ack=221 Win=1425 Len=110 TSval=569151 TSecr=3801155396 [TCP segment of a reassembled PDU]"
"8","5.013946","192.168.1.7","192.168.1.5","TCP","66","60876  >  8009 [ACK] Seq=221 Ack=221 Win=501 Len=0 TSval=3801155404 TSecr=569151"
"9","5.727042","192.168.1.2","224.0.0.251","MDNS","136","Standard query 0x0002 PTR _%9E5E7C8F47989526C9BCD95D24084F6F0B27C5ED._sub._googlecast._tcp.local, ""QM"" question PTR _googlecast._tcp.local, ""QM"" question"
"10","5.727090","192.168.1.5","224.0.0.251","MDNS","456","Standard query response 0x0000 PTR UnionTV-7990a23fb007d577b5112dbed190e2c8._googlecast._tcp.local TXT, cache flush SRV, cache flush 0 0 8009 7990a23f-b007-d577-b511-2dbed190e2c8.local A, cache flush 192.168.1.5"
"11","5.727101","192.168.1.5","224.0.0.251","MDNS","408","Standard query response 0x0000 PTR UnionTV-7990a23fb007d577b5112dbed190e2c8._googlecast._tcp.local TXT, cache flush SRV, cache flush 0 0 8009 7990a23f-b007-d577-b511-2dbed190e2c8.local A, cache flush 192.168.1.5"
"12","6.054086","192.168.1.7","216.239.32.116","UDP","108","32845  >  443 Len=66"
"13","6.853280","192.168.1.2","224.0.0.251","MDNS","136","Standard query 0x0003 PTR _%9E5E7C8F47989526C9BCD95D24084F6F0B27C5ED._sub._googlecast._tcp.local, ""QM"" question PTR _googlecast._tcp.local, ""QM"" question"
"14","6.853322","192.168.1.5","224.0.0.251","MDNS","456","Standard query response 0x0000 PTR UnionTV-7990a23fb007d577b5112dbed190e2c8._googlecast._tcp.local TXT, cache flush SRV, cache flush 0 0 8009 7990a23f-b007-d577-b511-2dbed190e2c8.local A, cache flush 192.168.1.5"
"15","6.853333","192.168.1.5","224.0.0.251","MDNS","408","Standard query response 0x0000 PTR UnionTV-7990a23fb007d577b5112dbed190e2c8._googlecast._tcp.local TXT, cache flush SRV, cache flush 0 0 8009 7990a23f-b007-d577-b511-2dbed190e2c8.local A, cache flush 192.168.1.5"
"16","10.014888","192.168.1.7","192.168.1.5","TCP","176","60876  >  8009 [PSH, ACK] Seq=221 Ack=221 Win=501 Len=110 TSval=3801160405 TSecr=569151 [TCP segment of a reassembled PDU]"
"17","10.021353","HuiZhouG_1c:cc:48","IntelCor_7a:04:86","ARP","42","Who has 192.168.1.7? Tell 192.168.1.5"
"18","10.021362","IntelCor_7a:04:86","HuiZhouG_1c:cc:48","ARP","42","192.168.1.7 is at 64:32:a8:7a:04:86"
"19","10.231621","192.168.1.5","192.168.1.7","TCP","176","8009  >  60876 [PSH, ACK] Seq=221 Ack=331 Win=1425 Len=110 TSval=569663 TSecr=3801160405 [TCP segment of a reassembled PDU]"
"20","10.231650","192.168.1.7","192.168.1.5","TCP","66","60876  >  8009 [ACK] Seq=331 Ack=331 Win=501 Len=0 TSval=3801160622 TSecr=569663"
"21","11.027548","192.168.1.7","34.247.232.119","TLSv1.2","97","Encrypted Alert"
"22","14.637164","192.168.1.5","224.0.0.251","MDNS","247","Standard query response 0x0000 PTR 3717effb6196dba0._spotify-connect._tcp.local PTR _spotify-connect._tcp.local SRV 0 0 35313 3717effb6196dba0.local TXT A 192.168.1.5"
"23","15.232463","192.168.1.7","192.168.1.5","TCP","176","60876  >  8009 [PSH, ACK] Seq=331 Ack=331 Win=501 Len=110 TSval=3801165623 TSecr=569663 [TCP segment of a reassembled PDU]"
"24","15.256650","192.168.1.5","192.168.1.7","TCP","176","8009  >  60876 [PSH, ACK] Seq=331 Ack=441 Win=1425 Len=110 TSval=570175 TSecr=3801165623 [TCP segment of a reassembled PDU]"
"25","15.256684","192.168.1.7","192.168.1.5","TCP","66","60876  >  8009 [ACK] Seq=441 Ack=441 Win=501 Len=0 TSval=3801165647 TSecr=570175"
"26","15.661899","192.168.1.5","224.0.0.251","MDNS","247","Standard query response 0x0000 PTR 3717effb6196dba0._spotify-connect._tcp.local PTR _spotify-connect._tcp.local SRV 0 0 35313 3717effb6196dba0.local TXT A 192.168.1.5"
"27","20.085807","192.168.1.7","157.240.216.60","TLSv1.2","97","Application Data"
"28","20.148264","157.240.216.60","192.168.1.7","TCP","66","443  >  38590 [ACK] Seq=1 Ack=32 Win=202 Len=0 TSval=207695208 TSecr=1151569030"
"29","20.236105","157.240.216.60","192.168.1.7","TLSv1.2","104","Application Data"
"30","20.236131","192.168.1.7","157.240.216.60","TCP","66","38590  >  443 [ACK] Seq=32 Ack=39 Win=501 Len=0 TSval=1151569180 TSecr=207695296"
"31","20.257332","192.168.1.7","192.168.1.5","TCP","176","60876  >  8009 [PSH, ACK] Seq=441 Ack=441 Win=501 Len=110 TSval=3801170647 TSecr=570175 [TCP segment of a reassembled PDU]"
"32","20.473127","192.168.1.5","192.168.1.7","TCP","176","8009  >  60876 [PSH, ACK] Seq=441 Ack=551 Win=1425 Len=110 TSval=570687 TSecr=3801170647 [TCP segment of a reassembled PDU]"
"33","20.473163","192.168.1.7","192.168.1.5","TCP","66","60876  >  8009 [ACK] Seq=551 Ack=551 Win=501 Len=0 TSval=3801170863 TSecr=570687"
"34","24.261283","192.168.1.5","224.0.0.251","MDNS","448","Standard query response 0x0000 TXT, cache flush PTR _androidtvremote._tcp.local PTR MATIASMOREIRA._androidtvremote._tcp.local SRV, cache flush 0 0 6466 Android.local PTR, cache flush Android.local PTR, cache flush Android.local A, cache flush 192.168.1.5 AAAA, cache flush fe80::fa4f:adff:fe1c:cc48 NSEC, cache flush MATIASMOREIRA._androidtvremote._tcp.local NSEC, cache flush 5.1.168.192.in-addr.arpa NSEC, cache flush 8.4.C.C.C.1.E.F.F.F.D.A.F.4.A.F.0.0.0.0.0.0.0.0.0.0.0.0.0.8.E.F.ip6.arpa NSEC, cache flush Android.local"
"35","24.261317","fe80::fa4f:adff:fe1c:cc48","ff02::fb","MDNS","468","Standard query response 0x0000 TXT, cache flush PTR _androidtvremote._tcp.local PTR MATIASMOREIRA._androidtvremote._tcp.local SRV, cache flush 0 0 6466 Android.local PTR, cache flush Android.local PTR, cache flush Android.local A, cache flush 192.168.1.5 AAAA, cache flush fe80::fa4f:adff:fe1c:cc48 NSEC, cache flush MATIASMOREIRA._androidtvremote._tcp.local NSEC, cache flush 5.1.168.192.in-addr.arpa NSEC, cache flush 8.4.C.C.C.1.E.F.F.F.D.A.F.4.A.F.0.0.0.0.0.0.0.0.0.0.0.0.0.8.E.F.ip6.arpa NSEC, cache flush Android.local"
"36","25.474272","192.168.1.7","192.168.1.5","TCP","176","60876  >  8009 [PSH, ACK] Seq=551 Ack=551 Win=501 Len=110 TSval=3801175864 TSecr=570687 [TCP segment of a reassembled PDU]"
"37","25.476463","HuiZhouG_1c:cc:48","IntelCor_7a:04:86","ARP","42","Who has 192.168.1.7? Tell 192.168.1.5"
"38","25.476471","IntelCor_7a:04:86","HuiZhouG_1c:cc:48","ARP","42","192.168.1.7 is at 64:32:a8:7a:04:86"
"39","25.479227","192.168.1.5","192.168.1.7","TCP","176","8009  >  60876 [PSH, ACK] Seq=551 Ack=661 Win=1425 Len=110 TSval=571197 TSecr=3801175864 [TCP segment of a reassembled PDU]"
"40","25.479245","192.168.1.7","192.168.1.5","TCP","66","60876  >  8009 [ACK] Seq=661 Ack=661 Win=501 Len=0 TSval=3801175869 TSecr=571197"
"41","26.821252","192.168.1.2","224.0.0.251","MDNS","136","Standard query 0x0004 PTR _%9E5E7C8F47989526C9BCD95D24084F6F0B27C5ED._sub._googlecast._tcp.local, ""QM"" question PTR _googlecast._tcp.local, ""QM"" question"
"42","26.821309","192.168.1.5","224.0.0.251","MDNS","456","Standard query response 0x0000 PTR UnionTV-7990a23fb007d577b5112dbed190e2c8._googlecast._tcp.local TXT, cache flush SRV, cache flush 0 0 8009 7990a23f-b007-d577-b511-2dbed190e2c8.local A, cache flush 192.168.1.5"
"43","26.821323","192.168.1.5","224.0.0.251","MDNS","408","Standard query response 0x0000 PTR UnionTV-7990a23fb007d577b5112dbed190e2c8._googlecast._tcp.local TXT, cache flush SRV, cache flush 0 0 8009 7990a23f-b007-d577-b511-2dbed190e2c8.local A, cache flush 192.168.1.5"
"44","27.641271","157.240.216.60","192.168.1.7","TLSv1.2","442","Application Data"
"45","27.641302","192.168.1.7","157.240.216.60","TCP","66","38590  >  443 [ACK] Seq=32 Ack=415 Win=499 Len=0 TSval=1151576585 TSecr=207702653"
"46","27.641322","157.240.216.60","192.168.1.7","TLSv1.2","738","Application Data"
"47","27.641328","192.168.1.7","157.240.216.60","TCP","66","38590  >  443 [ACK] Seq=32 Ack=1087 Win=494 Len=0 TSval=1151576585 TSecr=207702653"
"48","28.049827","157.240.216.60","192.168.1.7","TCP","1454","443  >  38590 [ACK] Seq=1087 Ack=32 Win=202 Len=1388 TSval=207703070 TSecr=1151576585 [TCP segment of a reassembled PDU]"
"49","28.049852","192.168.1.7","157.240.216.60","TCP","66","38590  >  443 [ACK] Seq=32 Ack=2475 Win=493 Len=0 TSval=1151576994 TSecr=207703070"
"50","28.085838","157.240.216.60","192.168.1.7","TLSv1.2","2842","[TCP Previous segment not captured] , Application Data"
"51","28.085876","192.168.1.7","157.240.216.60","TCP","78","[TCP Dup ACK 49#1] 38590  >  443 [ACK] Seq=32 Ack=2475 Win=493 Len=0 TSval=1151577030 TSecr=207703070 SLE=2709 SRE=5485"
"52","28.113275","157.240.216.60","192.168.1.7","TLSv1.2","896","Application Data"
"53","28.113307","192.168.1.7","157.240.216.60","TCP","78","[TCP Dup ACK 49#2] 38590  >  443 [ACK] Seq=32 Ack=2475 Win=493 Len=0 TSval=1151577057 TSecr=207703070 SLE=2709 SRE=6315"
"54","28.151252","157.240.216.60","192.168.1.7","TCP","300","[TCP Retransmission] 443  >  38590 [PSH, ACK] Seq=2475 Ack=32 Win=202 Len=234 TSval=207703209 TSecr=1151577030"
"55","28.151285","192.168.1.7","157.240.216.60","TCP","66","38590  >  443 [ACK] Seq=32 Ack=6315 Win=463 Len=0 TSval=1151577095 TSecr=207703209"
"56","28.189555","192.168.1.7","157.240.216.60","TLSv1.2","160","Application Data"
"57","28.253195","157.240.216.60","192.168.1.7","TCP","66","443  >  38590 [ACK] Seq=6315 Ack=126 Win=202 Len=0 TSval=207703313 TSecr=1151577134"
"58","28.388495","192.168.1.7","192.168.1.1","DNS","90","Standard query 0x6f28 A clients4.google.com OPT"
"59","28.401638","157.240.216.60","192.168.1.7","TLSv1.2","1469","[TCP Previous segment not captured] , Application Data"
"60","28.401657","192.168.1.7","157.240.216.60","TCP","78","[TCP Dup ACK 55#1] 38590  >  443 [ACK] Seq=126 Ack=6315 Win=501 Len=0 TSval=1151577346 TSecr=207703313 SLE=6348 SRE=7751"
"61","28.452886","192.168.1.1","192.168.1.7","DNS","130","Standard query response 0x6f28 A clients4.google.com CNAME clients.l.google.com A 216.58.222.78 OPT"
"62","28.454202","192.168.1.7","216.58.222.78","UDP","1392","54966  >  443 Len=1350"
"63","28.480633","157.240.216.60","192.168.1.7","TCP","99","[TCP Retransmission] 443  >  38590 [PSH, ACK] Seq=6315 Ack=126 Win=202 Len=33 TSval=207703540 TSecr=1151577346"
"64","28.480658","192.168.1.7","157.240.216.60","TCP","66","38590  >  443 [ACK] Seq=126 Ack=7751 Win=490 Len=0 TSval=1151577425 TSecr=207703540"
"65","28.543999","216.58.222.78","192.168.1.7","UDP","84","443  >  54966 Len=42"
"66","28.570854","216.58.222.78","192.168.1.7","UDP","1392","443  >  54966 Len=1350"
"67","28.570872","216.58.222.78","192.168.1.7","UDP","1392","443  >  54966 Len=1350"
"68","28.571961","192.168.1.7","216.58.222.78","UDP","1392","54966  >  443 Len=1350"
"69","28.658463","216.58.222.78","192.168.1.7","UDP","84","443  >  54966 Len=42"
"70","28.683668","216.58.222.78","192.168.1.7","UDP","1392","443  >  54966 Len=1350"
"71","28.683962","192.168.1.7","216.58.222.78","UDP","75","54966  >  443 Len=33"
"72","28.684101","192.168.1.7","216.58.222.78","UDP","1392","54966  >  443 Len=1350"
"73","28.684115","192.168.1.7","216.58.222.78","UDP","1109","54966  >  443 Len=1067"
"74","28.863334","192.168.1.7","216.58.222.78","UDP","1392","54966  >  443 Len=1350"
"75","28.935285","216.58.222.78","192.168.1.7","UDP","551","443  >  54966 Len=509"
"76","28.935443","192.168.1.7","216.58.222.78","UDP","77","54966  >  443 Len=35"
"77","28.938535","216.58.222.78","192.168.1.7","UDP","74","443  >  54966 Len=32"
"78","28.938634","192.168.1.7","216.58.222.78","UDP","79","54966  >  443 Len=37"
"79","28.938698","216.58.222.78","192.168.1.7","UDP","275","443  >  54966 Len=233"
"80","28.938779","192.168.1.7","216.58.222.78","UDP","79","54966  >  443 Len=37"
"81","28.970301","216.58.222.78","192.168.1.7","UDP","67","443  >  54966 Len=25"
"82","29.014411","216.58.222.78","192.168.1.7","UDP","523","443  >  54966 Len=481"
"83","29.014549","192.168.1.7","216.58.222.78","UDP","79","54966  >  443 Len=37"
"84","30.480018","192.168.1.7","192.168.1.5","TCP","176","60876  >  8009 [PSH, ACK] Seq=661 Ack=661 Win=501 Len=110 TSval=3801180870 TSecr=571197 [TCP segment of a reassembled PDU]"
"85","30.485745","192.168.1.5","192.168.1.7","TCP","176","8009  >  60876 [PSH, ACK] Seq=661 Ack=771 Win=1425 Len=110 TSval=571698 TSecr=3801180870 [TCP segment of a reassembled PDU]"
"86","30.485763","192.168.1.7","192.168.1.5","TCP","66","60876  >  8009 [ACK] Seq=771 Ack=771 Win=501 Len=0 TSval=3801180876 TSecr=571698"
"87","33.476412","Fiberhom_dd:8c:b8","IntelCor_7a:04:86","ARP","42","Who has 192.168.1.7? Tell 192.168.1.1"
"88","33.476426","IntelCor_7a:04:86","Fiberhom_dd:8c:b8","ARP","42","192.168.1.7 is at 64:32:a8:7a:04:86"
"89","33.555584","192.168.1.7","192.168.1.5","TCP","66","40280  >  8008 [ACK] Seq=1 Ack=1 Win=501 Len=0 TSval=3801183946 TSecr=567502"
"90","33.558587","192.168.1.5","192.168.1.7","TCP","66","[TCP ACKed unseen segment] 8008  >  40280 [ACK] Seq=1 Ack=2 Win=1375 Len=0 TSval=572005 TSecr=3797710348"
"91","35.486852","192.168.1.7","192.168.1.5","AJP13","176","AJP13 Error? [TCP segment of a reassembled PDU]"
"92","35.505124","192.168.1.5","192.168.1.7","AJP13","176","AJP13 Error? [TCP segment of a reassembled PDU]"
"93","35.505148","192.168.1.7","192.168.1.5","TCP","66","60876  >  8009 [ACK] Seq=881 Ack=881 Win=501 Len=0 TSval=3801185895 TSecr=572199"
"94","35.840385","192.168.1.7","239.255.255.250","SSDP","214","M-SEARCH * HTTP/1.1 "
"95","35.845715","192.168.1.5","192.168.1.7","UDP","554","52219  >  40656 Len=512"
"96","36.841197","192.168.1.7","239.255.255.250","SSDP","214","M-SEARCH * HTTP/1.1 "
"97","36.847383","192.168.1.5","192.168.1.7","UDP","554","57286  >  40656 Len=512"
"98","37.651576","192.168.1.7","192.168.1.5","TCP","66","40286  >  8008 [ACK] Seq=1 Ack=1 Win=502 Len=0 TSval=3801188042 TSecr=567909"
"99","37.655697","192.168.1.5","192.168.1.7","TCP","66","[TCP ACKed unseen segment] 8008  >  40286 [ACK] Seq=1 Ack=2 Win=1358 Len=0 TSval=572415 TSecr=3797710107"
"100","37.695572","192.168.1.7","64.233.190.188","TCP","66","34116  >  443 [ACK] Seq=1 Ack=1 Win=501 Len=0 TSval=3028573504 TSecr=3733666431"
"101","37.791405","64.233.190.188","192.168.1.7","TCP","66","[TCP ACKed unseen segment] 443  >  34116 [ACK] Seq=1 Ack=2 Win=265 Len=0 TSval=3733711530 TSecr=3027795345"
"102","37.842305","192.168.1.7","239.255.255.250","SSDP","214","M-SEARCH * HTTP/1.1 "
"103","37.846309","192.168.1.5","192.168.1.7","UDP","554","58705  >  40656 Len=512"
"104","38.843445","192.168.1.7","239.255.255.250","SSDP","214","M-SEARCH * HTTP/1.1 "
"105","38.848876","192.168.1.5","192.168.1.7","UDP","554","53461  >  40656 Len=512"
"106","40.506591","192.168.1.7","192.168.1.5","TCP","176","60876  >  8009 [PSH, ACK] Seq=881 Ack=881 Win=501 Len=110 TSval=3801190897 TSecr=572199 [TCP segment of a reassembled PDU]"
"107","40.511341","192.168.1.5","192.168.1.7","TCP","176","8009  >  60876 [PSH, ACK] Seq=881 Ack=991 Win=1425 Len=110 TSval=572701 TSecr=3801190897 [TCP segment of a reassembled PDU]"
"108","40.511370","192.168.1.7","192.168.1.5","TCP","66","60876  >  8009 [ACK] Seq=991 Ack=991 Win=501 Len=0 TSval=3801190901 TSecr=572701"
"109","43.685129","192.168.1.7","216.58.222.78","UDP","75","54966  >  443 Len=33"
"110","43.767259","216.58.222.78","192.168.1.7","UDP","67","443  >  54966 Len=25"
"111","45.512376","192.168.1.7","192.168.1.5","TCP","176","60876  >  8009 [PSH, ACK] Seq=991 Ack=991 Win=501 Len=110 TSval=3801195902 TSecr=572701 [TCP segment of a reassembled PDU]"
"112","45.516718","192.168.1.5","192.168.1.7","TCP","176","8009  >  60876 [PSH, ACK] Seq=991 Ack=1101 Win=1425 Len=110 TSval=573201 TSecr=3801195902 [TCP segment of a reassembled PDU]"
"113","45.516747","192.168.1.7","192.168.1.5","TCP","66","60876  >  8009 [ACK] Seq=1101 Ack=1101 Win=501 Len=0 TSval=3801195907 TSecr=573201"
"114","46.276075","fe80::1ecc:d6ff:fe82:29b4","ff02::2","ICMPv6","70","Router Solicitation from 1c:cc:d6:82:29:b4"
"115","46.788761","192.168.1.2","224.0.0.251","MDNS","136","Standard query 0x0005 PTR _%9E5E7C8F47989526C9BCD95D24084F6F0B27C5ED._sub._googlecast._tcp.local, ""QM"" question PTR _googlecast._tcp.local, ""QM"" question"
"116","46.788813","192.168.1.5","224.0.0.251","MDNS","456","Standard query response 0x0000 PTR UnionTV-7990a23fb007d577b5112dbed190e2c8._googlecast._tcp.local TXT, cache flush SRV, cache flush 0 0 8009 7990a23f-b007-d577-b511-2dbed190e2c8.local A, cache flush 192.168.1.5"
"117","46.788826","192.168.1.5","224.0.0.251","MDNS","408","Standard query response 0x0000 PTR UnionTV-7990a23fb007d577b5112dbed190e2c8._googlecast._tcp.local TXT, cache flush SRV, cache flush 0 0 8009 7990a23f-b007-d577-b511-2dbed190e2c8.local A, cache flush 192.168.1.5"
"118","50.518131","192.168.1.7","192.168.1.5","TCP","176","60876  >  8009 [PSH, ACK] Seq=1101 Ack=1101 Win=501 Len=110 TSval=3801200908 TSecr=573201 [TCP segment of a reassembled PDU]"
"119","50.522778","192.168.1.5","192.168.1.7","TCP","176","8009  >  60876 [PSH, ACK] Seq=1101 Ack=1211 Win=1425 Len=110 TSval=573702 TSecr=3801200908 [TCP segment of a reassembled PDU]"
"120","50.522796","192.168.1.7","192.168.1.5","TCP","66","60876  >  8009 [ACK] Seq=1211 Ack=1211 Win=501 Len=0 TSval=3801200913 TSecr=573702"
"121","53.085775","192.168.1.7","157.240.216.60","TLSv1.2","97","Application Data"
"122","53.147955","157.240.216.60","192.168.1.7","TCP","66","443  >  38590 [ACK] Seq=7751 Ack=157 Win=202 Len=0 TSval=207728207 TSecr=1151602030"
"123","53.235907","157.240.216.60","192.168.1.7","TLSv1.2","104","Application Data"
"124","53.235931","192.168.1.7","157.240.216.60","TCP","66","38590  >  443 [ACK] Seq=157 Ack=7789 Win=501 Len=0 TSval=1151602180 TSecr=207728295"
"125","55.523812","192.168.1.7","192.168.1.5","TCP","176","60876  >  8009 [PSH, ACK] Seq=1211 Ack=1211 Win=501 Len=110 TSval=3801205914 TSecr=573702 [TCP segment of a reassembled PDU]"
"126","55.530070","HuiZhouG_1c:cc:48","IntelCor_7a:04:86","ARP","42","Who has 192.168.1.7? Tell 192.168.1.5"
"127","55.530078","IntelCor_7a:04:86","HuiZhouG_1c:cc:48","ARP","42","192.168.1.7 is at 64:32:a8:7a:04:86"
"128","55.532130","192.168.1.5","192.168.1.7","TCP","176","8009  >  60876 [PSH, ACK] Seq=1211 Ack=1321 Win=1425 Len=110 TSval=574203 TSecr=3801205914 [TCP segment of a reassembled PDU]"
"129","55.532151","192.168.1.7","192.168.1.5","TCP","66","60876  >  8009 [ACK] Seq=1321 Ack=1321 Win=501 Len=0 TSval=3801205922 TSecr=574203"
"130","60.532610","192.168.1.7","192.168.1.5","TCP","176","60876  >  8009 [PSH, ACK] Seq=1321 Ack=1321 Win=501 Len=110 TSval=3801210923 TSecr=574203 [TCP segment of a reassembled PDU]"
"131","60.536865","192.168.1.5","192.168.1.7","TCP","176","8009  >  60876 [PSH, ACK] Seq=1321 Ack=1431 Win=1425 Len=110 TSval=574703 TSecr=3801210923 [TCP segment of a reassembled PDU]"
"132","60.536884","192.168.1.7","192.168.1.5","TCP","66","60876  >  8009 [ACK] Seq=1431 Ack=1431 Win=501 Len=0 TSval=3801210927 TSecr=574703"
"133","63.889076","192.168.1.5","224.0.0.251","MDNS","247","Standard query response 0x0000 PTR 3717effb6196dba0._spotify-connect._tcp.local PTR _spotify-connect._tcp.local SRV 0 0 35313 3717effb6196dba0.local TXT A 192.168.1.5"
"134","63.960571","192.168.1.7","192.168.1.1","DNS","100","Standard query 0x964f AAAA connectivity-check.ubuntu.com OPT"
"135","64.025966","192.168.1.1","192.168.1.7","DNS","161","Standard query response 0x964f AAAA connectivity-check.ubuntu.com SOA ns1.canonical.com OPT"
"136","64.027054","192.168.1.7","192.168.1.1","DNS","100","Standard query 0xfef5 AAAA connectivity-check.ubuntu.com OPT"
"137","64.089911","192.168.1.1","192.168.1.7","DNS","161","Standard query response 0xfef5 AAAA connectivity-check.ubuntu.com SOA ns1.canonical.com OPT"
"138","64.811618","192.168.1.5","224.0.0.251","MDNS","247","Standard query response 0x0000 PTR 3717effb6196dba0._spotify-connect._tcp.local PTR _spotify-connect._tcp.local SRV 0 0 35313 3717effb6196dba0.local TXT A 192.168.1.5"
"139","65.537285","192.168.1.7","192.168.1.5","TCP","176","60876  >  8009 [PSH, ACK] Seq=1431 Ack=1431 Win=501 Len=110 TSval=3801215927 TSecr=574703 [TCP segment of a reassembled PDU]"
"140","65.541689","192.168.1.5","192.168.1.7","TCP","176","8009  >  60876 [PSH, ACK] Seq=1431 Ack=1541 Win=1425 Len=110 TSval=575204 TSecr=3801215927 [TCP segment of a reassembled PDU]"
"141","65.541707","192.168.1.7","192.168.1.5","TCP","66","60876  >  8009 [ACK] Seq=1541 Ack=1541 Win=501 Len=0 TSval=3801215932 TSecr=575204"
"142","66.859760","192.168.1.2","224.0.0.251","MDNS","136","Standard query 0x0006 PTR _%9E5E7C8F47989526C9BCD95D24084F6F0B27C5ED._sub._googlecast._tcp.local, ""QM"" question PTR _googlecast._tcp.local, ""QM"" question"
"143","66.859794","192.168.1.5","224.0.0.251","MDNS","456","Standard query response 0x0000 PTR UnionTV-7990a23fb007d577b5112dbed190e2c8._googlecast._tcp.local TXT, cache flush SRV, cache flush 0 0 8009 7990a23f-b007-d577-b511-2dbed190e2c8.local A, cache flush 192.168.1.5"
"144","66.859800","192.168.1.5","224.0.0.251","MDNS","408","Standard query response 0x0000 PTR UnionTV-7990a23fb007d577b5112dbed190e2c8._googlecast._tcp.local TXT, cache flush SRV, cache flush 0 0 8009 7990a23f-b007-d577-b511-2dbed190e2c8.local A, cache flush 192.168.1.5"
"145","69.111127","Fiberhom_dd:8c:b8","IntelCor_7a:04:86","ARP","42","Who has 192.168.1.7? Tell 192.168.1.1"
"146","69.111139","IntelCor_7a:04:86","Fiberhom_dd:8c:b8","ARP","42","192.168.1.7 is at 64:32:a8:7a:04:86"
"147","70.542108","192.168.1.7","192.168.1.5","TCP","176","60876  >  8009 [PSH, ACK] Seq=1541 Ack=1541 Win=501 Len=110 TSval=3801220932 TSecr=575204 [TCP segment of a reassembled PDU]"
"148","70.750799","192.168.1.5","192.168.1.7","TCP","176","8009  >  60876 [PSH, ACK] Seq=1541 Ack=1651 Win=1425 Len=110 TSval=575715 TSecr=3801220932 [TCP segment of a reassembled PDU]"
"149","70.750834","192.168.1.7","192.168.1.5","TCP","66","60876  >  8009 [ACK] Seq=1651 Ack=1651 Win=501 Len=0 TSval=3801221141 TSecr=575715"
"150","71.085732","192.168.1.7","157.240.216.60","TLSv1.2","97","Application Data"
"151","71.147739","157.240.216.60","192.168.1.7","TCP","66","443  >  38590 [ACK] Seq=7789 Ack=188 Win=202 Len=0 TSval=207746207 TSecr=1151620030"
"152","71.673237","157.240.216.60","192.168.1.7","TLSv1.2","104","Application Data"
"153","71.673294","192.168.1.7","157.240.216.60","TCP","66","38590  >  443 [ACK] Seq=188 Ack=7827 Win=501 Len=0 TSval=1151620617 TSecr=207746616"
"154","72.767629","192.168.1.7","216.58.222.78","UDP","108","54966  >  443 Len=66"
"155","75.752100","192.168.1.7","192.168.1.5","TCP","147","60876  >  8009 [PSH, ACK] Seq=1651 Ack=1651 Win=501 Len=81 TSval=3801226142 TSecr=575715 [TCP segment of a reassembled PDU]"
"156","75.752862","192.168.1.7","192.168.1.5","TCP","117","60876  >  8009 [PSH, ACK] Seq=1732 Ack=1651 Win=501 Len=51 TSval=3801226143 TSecr=575715 [TCP segment of a reassembled PDU]"
"157","75.753162","HuiZhouG_1c:cc:48","IntelCor_7a:04:86","ARP","42","Who has 192.168.1.7? Tell 192.168.1.5"
"158","75.753171","IntelCor_7a:04:86","HuiZhouG_1c:cc:48","ARP","42","192.168.1.7 is at 64:32:a8:7a:04:86"
"159","75.755456","192.168.1.5","192.168.1.7","TCP","66","8009  >  60876 [ACK] Seq=1651 Ack=1783 Win=1425 Len=0 TSval=576225 TSecr=3801226142"
"160","75.756568","192.168.1.5","192.168.1.7","TCP","176","8009  >  60876 [PSH, ACK] Seq=1651 Ack=1783 Win=1425 Len=110 TSval=576225 TSecr=3801226142 [TCP segment of a reassembled PDU]"
"161","75.756587","192.168.1.7","192.168.1.5","TCP","66","60876  >  8009 [ACK] Seq=1783 Ack=1761 Win=501 Len=0 TSval=3801226147 TSecr=576225"
"162","78.611603","192.168.1.7","192.168.1.5","TCP","66","[TCP Dup ACK 89#1] 40280  >  8008 [ACK] Seq=1 Ack=1 Win=501 Len=0 TSval=3801229002 TSecr=572005"
"163","78.614806","192.168.1.5","192.168.1.7","TCP","66","[TCP Dup ACK 90#1] [TCP ACKed unseen segment] 8008  >  40280 [ACK] Seq=1 Ack=2 Win=1375 Len=0 TSval=576511 TSecr=3797710348"
"164","80.757895","192.168.1.7","192.168.1.5","TCP","176","60876  >  8009 [PSH, ACK] Seq=1783 Ack=1761 Win=501 Len=110 TSval=3801231148 TSecr=576225 [TCP segment of a reassembled PDU]"
"165","80.762126","192.168.1.5","192.168.1.7","TCP","176","8009  >  60876 [PSH, ACK] Seq=1761 Ack=1893 Win=1425 Len=110 TSval=576726 TSecr=3801231148 [TCP segment of a reassembled PDU]"
"166","80.762171","192.168.1.7","192.168.1.5","TCP","66","60876  >  8009 [ACK] Seq=1893 Ack=1871 Win=501 Len=0 TSval=3801231152 TSecr=576726"
"167","82.707580","192.168.1.7","192.168.1.5","TCP","66","[TCP Dup ACK 98#1] 40286  >  8008 [ACK] Seq=1 Ack=1 Win=502 Len=0 TSval=3801233098 TSecr=572415"
"168","82.710995","192.168.1.5","192.168.1.7","TCP","66","[TCP Dup ACK 99#1] [TCP ACKed unseen segment] 8008  >  40286 [ACK] Seq=1 Ack=2 Win=1358 Len=0 TSval=576921 TSecr=3797710107"
"169","82.791590","192.168.1.7","64.233.190.188","TCP","66","[TCP Dup ACK 100#1] 34116  >  443 [ACK] Seq=1 Ack=1 Win=501 Len=0 TSval=3028618600 TSecr=3733711530"
"170","82.887305","64.233.190.188","192.168.1.7","TCP","66","[TCP Dup ACK 101#1] [TCP ACKed unseen segment] 443  >  34116 [ACK] Seq=1 Ack=2 Win=265 Len=0 TSval=3733756626 TSecr=3027795345"
"171","85.762635","192.168.1.7","192.168.1.5","TCP","176","60876  >  8009 [PSH, ACK] Seq=1893 Ack=1871 Win=501 Len=110 TSval=3801236153 TSecr=576726 [TCP segment of a reassembled PDU]"
"172","85.766992","192.168.1.5","192.168.1.7","TCP","176","8009  >  60876 [PSH, ACK] Seq=1871 Ack=2003 Win=1425 Len=110 TSval=577226 TSecr=3801236153 [TCP segment of a reassembled PDU]"
"173","85.767009","192.168.1.7","192.168.1.5","TCP","66","60876  >  8009 [ACK] Seq=2003 Ack=1981 Win=501 Len=0 TSval=3801236157 TSecr=577226"
"174","86.827814","192.168.1.2","224.0.0.251","MDNS","136","Standard query 0x0007 PTR _%9E5E7C8F47989526C9BCD95D24084F6F0B27C5ED._sub._googlecast._tcp.local, ""QM"" question PTR _googlecast._tcp.local, ""QM"" question"
"175","86.827866","192.168.1.5","224.0.0.251","MDNS","456","Standard query response 0x0000 PTR UnionTV-7990a23fb007d577b5112dbed190e2c8._googlecast._tcp.local TXT, cache flush SRV, cache flush 0 0 8009 7990a23f-b007-d577-b511-2dbed190e2c8.local A, cache flush 192.168.1.5"
"176","86.827881","192.168.1.5","224.0.0.251","MDNS","408","Standard query response 0x0000 PTR UnionTV-7990a23fb007d577b5112dbed190e2c8._googlecast._tcp.local TXT, cache flush SRV, cache flush 0 0 8009 7990a23f-b007-d577-b511-2dbed190e2c8.local A, cache flush 192.168.1.5"
"177","88.260878","192.168.1.5","224.0.0.251","MDNS","448","Standard query response 0x0000 TXT, cache flush PTR _androidtvremote._tcp.local PTR MATIASMOREIRA._androidtvremote._tcp.local SRV, cache flush 0 0 6466 Android.local PTR, cache flush Android.local PTR, cache flush Android.local A, cache flush 192.168.1.5 AAAA, cache flush fe80::fa4f:adff:fe1c:cc48 NSEC, cache flush MATIASMOREIRA._androidtvremote._tcp.local NSEC, cache flush 5.1.168.192.in-addr.arpa NSEC, cache flush 8.4.C.C.C.1.E.F.F.F.D.A.F.4.A.F.0.0.0.0.0.0.0.0.0.0.0.0.0.8.E.F.ip6.arpa NSEC, cache flush Android.local"
"178","88.260926","fe80::fa4f:adff:fe1c:cc48","ff02::fb","MDNS","468","Standard query response 0x0000 TXT, cache flush PTR _androidtvremote._tcp.local PTR MATIASMOREIRA._androidtvremote._tcp.local SRV, cache flush 0 0 6466 Android.local PTR, cache flush Android.local PTR, cache flush Android.local A, cache flush 192.168.1.5 AAAA, cache flush fe80::fa4f:adff:fe1c:cc48 NSEC, cache flush MATIASMOREIRA._androidtvremote._tcp.local NSEC, cache flush 5.1.168.192.in-addr.arpa NSEC, cache flush 8.4.C.C.C.1.E.F.F.F.D.A.F.4.A.F.0.0.0.0.0.0.0.0.0.0.0.0.0.8.E.F.ip6.arpa NSEC, cache flush Android.local"
"179","90.768382","192.168.1.7","192.168.1.5","TCP","176","60876  >  8009 [PSH, ACK] Seq=2003 Ack=1981 Win=501 Len=110 TSval=3801241158 TSecr=577226 [TCP segment of a reassembled PDU]"
"180","90.772809","192.168.1.5","192.168.1.7","TCP","176","8009  >  60876 [PSH, ACK] Seq=1981 Ack=2113 Win=1425 Len=110 TSval=577727 TSecr=3801241158 [TCP segment of a reassembled PDU]"
"181","90.772828","192.168.1.7","192.168.1.5","TCP","66","60876  >  8009 [ACK] Seq=2113 Ack=2091 Win=501 Len=0 TSval=3801241163 TSecr=577727"
"182","95.773780","192.168.1.7","192.168.1.5","TCP","176","60876  >  8009 [PSH, ACK] Seq=2113 Ack=2091 Win=501 Len=110 TSval=3801246164 TSecr=577727 [TCP segment of a reassembled PDU]"
"183","95.778835","HuiZhouG_1c:cc:48","IntelCor_7a:04:86","ARP","42","Who has 192.168.1.7? Tell 192.168.1.5"
"184","95.778843","IntelCor_7a:04:86","HuiZhouG_1c:cc:48","ARP","42","192.168.1.7 is at 64:32:a8:7a:04:86"
"185","95.783599","192.168.1.5","192.168.1.7","TCP","176","8009  >  60876 [PSH, ACK] Seq=2091 Ack=2223 Win=1425 Len=110 TSval=578228 TSecr=3801246164 [TCP segment of a reassembled PDU]"
"186","95.783619","192.168.1.7","192.168.1.5","TCP","66","60876  >  8009 [ACK] Seq=2223 Ack=2201 Win=501 Len=0 TSval=3801246174 TSecr=578228"
"187","97.085736","192.168.1.7","157.240.216.60","TLSv1.2","97","Application Data"
"188","97.148713","157.240.216.60","192.168.1.7","TCP","66","443  >  38590 [ACK] Seq=7827 Ack=219 Win=202 Len=0 TSval=207772208 TSecr=1151646030"
"189","97.236880","157.240.216.60","192.168.1.7","TLSv1.2","104","Application Data"
"190","97.236899","192.168.1.7","157.240.216.60","TCP","66","38590  >  443 [ACK] Seq=219 Ack=7865 Win=501 Len=0 TSval=1151646181 TSecr=207772295"
"191","100.784930","192.168.1.7","192.168.1.5","TCP","176","60876  >  8009 [PSH, ACK] Seq=2223 Ack=2201 Win=501 Len=110 TSval=3801251175 TSecr=578228 [TCP segment of a reassembled PDU]"
"192","100.792267","192.168.1.5","192.168.1.7","TCP","176","8009  >  60876 [PSH, ACK] Seq=2201 Ack=2333 Win=1425 Len=110 TSval=578729 TSecr=3801251175 [TCP segment of a reassembled PDU]"
"193","100.792286","192.168.1.7","192.168.1.5","TCP","66","60876  >  8009 [ACK] Seq=2333 Ack=2311 Win=501 Len=0 TSval=3801251182 TSecr=578729"
"194","105.793667","192.168.1.7","192.168.1.5","TCP","176","60876  >  8009 [PSH, ACK] Seq=2333 Ack=2311 Win=501 Len=110 TSval=3801256184 TSecr=578729 [TCP segment of a reassembled PDU]"
"195","105.799909","192.168.1.5","192.168.1.7","TCP","176","8009  >  60876 [PSH, ACK] Seq=2311 Ack=2443 Win=1425 Len=110 TSval=579230 TSecr=3801256184 [TCP segment of a reassembled PDU]"
"196","105.799936","192.168.1.7","192.168.1.5","TCP","66","60876  >  8009 [ACK] Seq=2443 Ack=2421 Win=501 Len=0 TSval=3801256190 TSecr=579230"
"197","106.795635","192.168.1.2","224.0.0.251","MDNS","136","Standard query 0x0008 PTR _%9E5E7C8F47989526C9BCD95D24084F6F0B27C5ED._sub._googlecast._tcp.local, ""QM"" question PTR _googlecast._tcp.local, ""QM"" question"
"198","106.795668","192.168.1.5","224.0.0.251","MDNS","456","Standard query response 0x0000 PTR UnionTV-7990a23fb007d577b5112dbed190e2c8._googlecast._tcp.local TXT, cache flush SRV, cache flush 0 0 8009 7990a23f-b007-d577-b511-2dbed190e2c8.local A, cache flush 192.168.1.5"
"199","106.795674","192.168.1.5","224.0.0.251","MDNS","408","Standard query response 0x0000 PTR UnionTV-7990a23fb007d577b5112dbed190e2c8._googlecast._tcp.local TXT, cache flush SRV, cache flush 0 0 8009 7990a23f-b007-d577-b511-2dbed190e2c8.local A, cache flush 192.168.1.5"
"200","110.801331","192.168.1.7","192.168.1.5","TCP","176","60876  >  8009 [PSH, ACK] Seq=2443 Ack=2421 Win=501 Len=110 TSval=3801261191 TSecr=579230 [TCP segment of a reassembled PDU]"
"201","110.808962","192.168.1.5","192.168.1.7","TCP","176","8009  >  60876 [PSH, ACK] Seq=2421 Ack=2553 Win=1425 Len=110 TSval=579731 TSecr=3801261191 [TCP segment of a reassembled PDU]"
"202","110.808991","192.168.1.7","192.168.1.5","TCP","66","60876  >  8009 [ACK] Seq=2553 Ack=2531 Win=501 Len=0 TSval=3801261199 TSecr=579731"
"203","113.143837","192.168.1.5","224.0.0.251","MDNS","247","Standard query response 0x0000 PTR 3717effb6196dba0._spotify-connect._tcp.local PTR _spotify-connect._tcp.local SRV 0 0 35313 3717effb6196dba0.local TXT A 192.168.1.5"
"204","114.167859","192.168.1.5","224.0.0.251","MDNS","247","Standard query response 0x0000 PTR 3717effb6196dba0._spotify-connect._tcp.local PTR _spotify-connect._tcp.local SRV 0 0 35313 3717effb6196dba0.local TXT A 192.168.1.5"
"205","115.810075","192.168.1.7","192.168.1.5","TCP","176","60876  >  8009 [PSH, ACK] Seq=2553 Ack=2531 Win=501 Len=110 TSval=3801266200 TSecr=579731 [TCP segment of a reassembled PDU]"
"206","115.818310","192.168.1.5","192.168.1.7","TCP","176","8009  >  60876 [PSH, ACK] Seq=2531 Ack=2663 Win=1425 Len=110 TSval=580231 TSecr=3801266200 [TCP segment of a reassembled PDU]"
"207","115.818337","192.168.1.7","192.168.1.5","TCP","66","60876  >  8009 [ACK] Seq=2663 Ack=2641 Win=501 Len=0 TSval=3801266208 TSecr=580231"
"208","115.818351","HuiZhouG_1c:cc:48","IntelCor_7a:04:86","ARP","42","Who has 192.168.1.7? Tell 192.168.1.5"
"209","115.818358","IntelCor_7a:04:86","HuiZhouG_1c:cc:48","ARP","42","192.168.1.7 is at 64:32:a8:7a:04:86"
"210","120.085744","192.168.1.7","157.240.216.60","TLSv1.2","97","Application Data"
"211","120.088719","fe80::fa4f:adff:fe1c:cc48","ff02::16","ICMPv6","90","Multicast Listener Report Message v2"
"212","120.148822","157.240.216.60","192.168.1.7","TCP","66","443  >  38590 [ACK] Seq=7865 Ack=250 Win=202 Len=0 TSval=207795207 TSecr=1151669030"
"213","120.236889","157.240.216.60","192.168.1.7","TLSv1.2","104","Application Data"
"214","120.236908","192.168.1.7","157.240.216.60","TCP","66","38590  >  443 [ACK] Seq=250 Ack=7903 Win=501 Len=0 TSval=1151669181 TSecr=207795295"
"215","120.517132","192.168.1.5","224.0.0.251","MDNS","185","Standard query 0x0000 ANY MATIASMOREIRA._androidtvremote._tcp.local, ""QU"" question ANY Android.local, ""QU"" question ANY Android.local, ""QU"" question SRV 0 0 6466 Android.local A 192.168.1.5 AAAA fe80::fa4f:adff:fe1c:cc48"
"216","120.517165","fe80::fa4f:adff:fe1c:cc48","ff02::fb","MDNS","205","Standard query 0x0000 ANY MATIASMOREIRA._androidtvremote._tcp.local, ""QU"" question ANY Android.local, ""QU"" question ANY Android.local, ""QU"" question SRV 0 0 6466 Android.local A 192.168.1.5 AAAA fe80::fa4f:adff:fe1c:cc48"
"217","120.721748","fe80::fa4f:adff:fe1c:cc48","ff02::16","ICMPv6","90","Multicast Listener Report Message v2"
"218","120.729183","192.168.1.5","224.0.0.251","MDNS","185","Standard query 0x0000 ANY MATIASMOREIRA._androidtvremote._tcp.local, ""QM"" question ANY Android.local, ""QM"" question ANY Android.local, ""QM"" question SRV 0 0 6466 Android.local A 192.168.1.5 AAAA fe80::fa4f:adff:fe1c:cc48"
"219","120.729825","fe80::fa4f:adff:fe1c:cc48","ff02::fb","MDNS","205","Standard query 0x0000 ANY MATIASMOREIRA._androidtvremote._tcp.local, ""QM"" question ANY Android.local, ""QM"" question ANY Android.local, ""QM"" question SRV 0 0 6466 Android.local A 192.168.1.5 AAAA fe80::fa4f:adff:fe1c:cc48"
"220","120.819796","192.168.1.7","192.168.1.5","TCP","176","60876  >  8009 [PSH, ACK] Seq=2663 Ack=2641 Win=501 Len=110 TSval=3801271210 TSecr=580231 [TCP segment of a reassembled PDU]"
"221","120.828329","192.168.1.5","192.168.1.7","TCP","176","8009  >  60876 [PSH, ACK] Seq=2641 Ack=2773 Win=1425 Len=110 TSval=580733 TSecr=3801271210 [TCP segment of a reassembled PDU]"
"222","120.828353","192.168.1.7","192.168.1.5","TCP","66","60876  >  8009 [ACK] Seq=2773 Ack=2751 Win=501 Len=0 TSval=3801271218 TSecr=580733"
"223","121.030133","192.168.1.5","224.0.0.251","MDNS","185","Standard query 0x0000 ANY MATIASMOREIRA._androidtvremote._tcp.local, ""QM"" question ANY Android.local, ""QM"" question ANY Android.local, ""QM"" question SRV 0 0 6466 Android.local A 192.168.1.5 AAAA fe80::fa4f:adff:fe1c:cc48"
"224","121.030168","fe80::fa4f:adff:fe1c:cc48","ff02::fb","MDNS","205","Standard query 0x0000 ANY MATIASMOREIRA._androidtvremote._tcp.local, ""QM"" question ANY Android.local, ""QM"" question ANY Android.local, ""QM"" question SRV 0 0 6466 Android.local A 192.168.1.5 AAAA fe80::fa4f:adff:fe1c:cc48"
"225","121.337740","192.168.1.5","224.0.0.251","MDNS","448","Standard query response 0x0000 TXT, cache flush PTR _androidtvremote._tcp.local PTR MATIASMOREIRA._androidtvremote._tcp.local SRV, cache flush 0 0 6466 Android.local PTR, cache flush Android.local PTR, cache flush Android.local A, cache flush 192.168.1.5 AAAA, cache flush fe80::fa4f:adff:fe1c:cc48 NSEC, cache flush MATIASMOREIRA._androidtvremote._tcp.local NSEC, cache flush 5.1.168.192.in-addr.arpa NSEC, cache flush 8.4.C.C.C.1.E.F.F.F.D.A.F.4.A.F.0.0.0.0.0.0.0.0.0.0.0.0.0.8.E.F.ip6.arpa NSEC, cache flush Android.local"
"226","121.337782","fe80::fa4f:adff:fe1c:cc48","ff02::fb","MDNS","468","Standard query response 0x0000 TXT, cache flush PTR _androidtvremote._tcp.local PTR MATIASMOREIRA._androidtvremote._tcp.local SRV, cache flush 0 0 6466 Android.local PTR, cache flush Android.local PTR, cache flush Android.local A, cache flush 192.168.1.5 AAAA, cache flush fe80::fa4f:adff:fe1c:cc48 NSEC, cache flush MATIASMOREIRA._androidtvremote._tcp.local NSEC, cache flush 5.1.168.192.in-addr.arpa NSEC, cache flush 8.4.C.C.C.1.E.F.F.F.D.A.F.4.A.F.0.0.0.0.0.0.0.0.0.0.0.0.0.8.E.F.ip6.arpa NSEC, cache flush Android.local"
"227","122.258413","192.168.1.5","224.0.0.251","MDNS","448","Standard query response 0x0000 TXT, cache flush PTR _androidtvremote._tcp.local PTR MATIASMOREIRA._androidtvremote._tcp.local SRV, cache flush 0 0 6466 Android.local PTR, cache flush Android.local PTR, cache flush Android.local A, cache flush 192.168.1.5 AAAA, cache flush fe80::fa4f:adff:fe1c:cc48 NSEC, cache flush MATIASMOREIRA._androidtvremote._tcp.local NSEC, cache flush 5.1.168.192.in-addr.arpa NSEC, cache flush 8.4.C.C.C.1.E.F.F.F.D.A.F.4.A.F.0.0.0.0.0.0.0.0.0.0.0.0.0.8.E.F.ip6.arpa NSEC, cache flush Android.local"
"228","122.258460","fe80::fa4f:adff:fe1c:cc48","ff02::fb","MDNS","468","Standard query response 0x0000 TXT, cache flush PTR _androidtvremote._tcp.local PTR MATIASMOREIRA._androidtvremote._tcp.local SRV, cache flush 0 0 6466 Android.local PTR, cache flush Android.local PTR, cache flush Android.local A, cache flush 192.168.1.5 AAAA, cache flush fe80::fa4f:adff:fe1c:cc48 NSEC, cache flush MATIASMOREIRA._androidtvremote._tcp.local NSEC, cache flush 5.1.168.192.in-addr.arpa NSEC, cache flush 8.4.C.C.C.1.E.F.F.F.D.A.F.4.A.F.0.0.0.0.0.0.0.0.0.0.0.0.0.8.E.F.ip6.arpa NSEC, cache flush Android.local"
"229","123.667584","192.168.1.7","192.168.1.5","TCP","66","[TCP Dup ACK 89#2] 40280  >  8008 [ACK] Seq=1 Ack=1 Win=501 Len=0 TSval=3801274058 TSecr=576511"
"230","123.672107","192.168.1.5","192.168.1.7","TCP","66","[TCP Dup ACK 90#2] [TCP ACKed unseen segment] 8008  >  40280 [ACK] Seq=1 Ack=2 Win=1375 Len=0 TSval=581017 TSecr=3797710348"
"231","124.305916","192.168.1.5","224.0.0.251","MDNS","448","Standard query response 0x0000 TXT, cache flush PTR _androidtvremote._tcp.local PTR MATIASMOREIRA._androidtvremote._tcp.local SRV, cache flush 0 0 6466 Android.local PTR, cache flush Android.local PTR, cache flush Android.local A, cache flush 192.168.1.5 AAAA, cache flush fe80::fa4f:adff:fe1c:cc48 NSEC, cache flush MATIASMOREIRA._androidtvremote._tcp.local NSEC, cache flush 5.1.168.192.in-addr.arpa NSEC, cache flush 8.4.C.C.C.1.E.F.F.F.D.A.F.4.A.F.0.0.0.0.0.0.0.0.0.0.0.0.0.8.E.F.ip6.arpa NSEC, cache flush Android.local"
